{
  "documents": [
    {
      "atom_aware_precision": "NA",
      "atom_aware_recall": "NA",
      "fn": 0,
      "fp": 0,
      "gold_reconstructable": true,
      "n_adjudicated_predictions": 0,
      "n_gold_triples": 0,
      "n_sensor_directed_edges": 0,
      "n_unadjudicated_extra_edges": 0,
      "source_id": "rs1-dotenv-linkding",
      "split_role": "development",
      "tp": 0
    },
    {
      "atom_aware_precision": "NA",
      "atom_aware_recall": 0.0,
      "fn": 41,
      "fp": 0,
      "gold_reconstructable": true,
      "n_adjudicated_predictions": 0,
      "n_gold_triples": 41,
      "n_sensor_directed_edges": 3651,
      "n_unadjudicated_extra_edges": 3651,
      "source_id": "rs1-props-hadoop-log4j",
      "split_role": "development",
      "tp": 0
    },
    {
      "atom_aware_precision": 1.0,
      "atom_aware_recall": 0.851528384279476,
      "fn": 34,
      "fp": 0,
      "gold_reconstructable": true,
      "n_adjudicated_predictions": 195,
      "n_gold_triples": 229,
      "n_sensor_directed_edges": 440,
      "n_unadjudicated_extra_edges": 245,
      "source_id": "rs1-ini-oe-bitbake",
      "split_role": "development",
      "tp": 195
    },
    {
      "atom_aware_precision": 1.0,
      "atom_aware_recall": 1.0,
      "fn": 0,
      "fp": 0,
      "gold_reconstructable": true,
      "n_adjudicated_predictions": 1,
      "n_gold_triples": 1,
      "n_sensor_directed_edges": 1,
      "n_unadjudicated_extra_edges": 0,
      "source_id": "rs1-dotenv-koel",
      "split_role": "evaluation",
      "tp": 1
    },
    {
      "atom_aware_precision": "NA",
      "atom_aware_recall": "NA",
      "fn": 0,
      "fp": 0,
      "gold_reconstructable": true,
      "n_adjudicated_predictions": 0,
      "n_gold_triples": 0,
      "n_sensor_directed_edges": 0,
      "n_unadjudicated_extra_edges": 0,
      "source_id": "rs1-dotenv-bookstack",
      "split_role": "evaluation",
      "tp": 0
    },
    {
      "atom_aware_precision": 1.0,
      "atom_aware_recall": 1.0,
      "fn": 0,
      "fp": 0,
      "gold_reconstructable": true,
      "n_adjudicated_predictions": 2,
      "n_gold_triples": 2,
      "n_sensor_directed_edges": 2,
      "n_unadjudicated_extra_edges": 0,
      "source_id": "rs1-dotenv-laravel",
      "split_role": "evaluation",
      "tp": 2
    },
    {
      "atom_aware_precision": "NA",
      "atom_aware_recall": 0.0,
      "fn": 7,
      "fp": 0,
      "gold_reconstructable": true,
      "n_adjudicated_predictions": 0,
      "n_gold_triples": 7,
      "n_sensor_directed_edges": 158,
      "n_unadjudicated_extra_edges": 158,
      "source_id": "rs1-props-ratis-log4j",
      "split_role": "evaluation",
      "tp": 0
    },
    {
      "atom_aware_precision": "NA",
      "atom_aware_recall": "NA",
      "fn": 0,
      "fp": 0,
      "gold_reconstructable": true,
      "n_adjudicated_predictions": 0,
      "n_gold_triples": 0,
      "n_sensor_directed_edges": 3,
      "n_unadjudicated_extra_edges": 3,
      "source_id": "rs1-props-kafka-server",
      "split_role": "evaluation",
      "tp": 0
    },
    {
      "atom_aware_precision": "NA",
      "atom_aware_recall": "NA",
      "fn": 0,
      "fp": 0,
      "gold_reconstructable": true,
      "n_adjudicated_predictions": 0,
      "n_gold_triples": 0,
      "n_sensor_directed_edges": 588,
      "n_unadjudicated_extra_edges": 588,
      "source_id": "rs1-props-tomcat-logging",
      "split_role": "evaluation",
      "tp": 0
    },
    {
      "atom_aware_precision": "NA",
      "atom_aware_recall": "NA",
      "fn": 0,
      "fp": 0,
      "gold_reconstructable": true,
      "n_adjudicated_predictions": 0,
      "n_gold_triples": 0,
      "n_sensor_directed_edges": 152,
      "n_unadjudicated_extra_edges": 152,
      "source_id": "rs1-ini-polybar",
      "split_role": "evaluation",
      "tp": 0
    },
    {
      "atom_aware_precision": "NA",
      "atom_aware_recall": "NA",
      "fn": 0,
      "fp": 0,
      "gold_reconstructable": true,
      "n_adjudicated_predictions": 0,
      "n_gold_triples": 0,
      "n_sensor_directed_edges": 12,
      "n_unadjudicated_extra_edges": 12,
      "source_id": "rs1-ini-gogs",
      "split_role": "evaluation",
      "tp": 0
    },
    {
      "atom_aware_precision": 1.0,
      "atom_aware_recall": 1.0,
      "fn": 0,
      "fp": 0,
      "gold_reconstructable": true,
      "n_adjudicated_predictions": 8,
      "n_gold_triples": 8,
      "n_sensor_directed_edges": 183,
      "n_unadjudicated_extra_edges": 175,
      "source_id": "rs1-ini-tegra-common",
      "split_role": "evaluation",
      "tp": 8
    }
  ],
  "gold_identity": "(source_line, NAME, dest_line)",
  "prediction_identity": "(source_line, atom, dest_line)",
  "revision": "phase4d-measurement-semantics-v0.1",
  "schema": "bite-phase4d-atom-aware-reference/v0.1"
}
